{
  "dataset": "official",
  "sample_id": "locomo_conv-48",
  "source": {
    "benchmark": "LoCoMo-Refined",
    "source_id": "conv-48",
    "add_mode": "full_conversation",
    "conversion_mode": "guide_compat",
    "speaker_a": "Deborah",
    "speaker_b": "Jolene"
  },
  "isolation": {
    "user_id": "eval:locomo:conv-48",
    "session_ids": [
      "sess-1",
      "sess-2",
      "sess-3",
      "sess-4",
      "sess-5",
      "sess-6",
      "sess-7",
      "sess-8",
      "sess-9",
      "sess-10",
      "sess-11",
      "sess-12",
      "sess-13",
      "sess-14",
      "sess-15",
      "sess-16",
      "sess-17",
      "sess-18",
      "sess-19",
      "sess-20",
      "sess-21",
      "sess-22",
      "sess-23",
      "sess-24",
      "sess-25",
      "sess-26",
      "sess-27",
      "sess-28",
      "sess-29",
      "sess-30"
    ]
  },
  "add_phase": {
    "sessions": [
      {
        "session_id": "sess-1",
        "messages": [
          {
            "role": "user",
            "content": "Deborah: Hey Jolene, nice to meet you! How's your week going? Anything fun happened?"
          },
          {
            "role": "assistant",
            "content": "Jolene: Hi Deb! Good to meet you! Yeah, my week's been busy. I finished an electrical engineering project last week - took a lot of work, but it's done now. Anything fun happening for you?"
          },
          {
            "role": "user",
            "content": "Deborah: Congrats! Last week I visited a place that holds a lot of memories for me. It was my mother`s old house."
          },
          {
            "role": "assistant",
            "content": "Jolene: Why does it hold such special memories for you?"
          },
          {
            "role": "user",
            "content": "Deborah: It was full of memories, she passed away a few years ago. This is our last photo together."
          },
          {
            "role": "assistant",
            "content": "Jolene: Sorry about your loss, Deb. My mother also passed away last year. This is my room in her house, I also have many memories there. Is there anything special about it you remember?"
          },
          {
            "role": "user",
            "content": "Deborah: My mom's house had a special bench near the window. She loved to sit there every morning and take in the view. I come to sit here sometimes, it helps me stay connected to her."
          },
          {
            "role": "assistant",
            "content": "Jolene: Staying connected is super important. Do you have something to remember her by? This pendant reminds me of my mother, she gave it to me in 2010  in Paris."
          },
          {
            "role": "user",
            "content": "Deborah: Yes, I also have a pendant that reminds me of my mother. And what is special for you about your jewelry?"
          },
          {
            "role": "assistant",
            "content": "Jolene: It has a special symbol on it that represents freedom for me. It's a nice reminder to go for my goals and not get held back."
          },
          {
            "role": "user",
            "content": "Deborah: It should really give you strength and energy!"
          },
          {
            "role": "assistant",
            "content": "Jolene: Do you have goals?"
          },
          {
            "role": "user",
            "content": "Deborah: One of my goals is to keep teaching yoga and supporting my community. I'm passionate about helping people find peace and joy through it."
          },
          {
            "role": "assistant",
            "content": "Jolene: What inspired you to go down this route?"
          },
          {
            "role": "user",
            "content": "Deborah: Yoga helped me find peace during a rough time, and now I'm passionate about sharing that with others."
          },
          {
            "role": "assistant",
            "content": "Jolene: It is truly inspiring!"
          },
          {
            "role": "user",
            "content": "Deborah: Gotta run, bye!"
          },
          {
            "role": "assistant",
            "content": "Jolene: Looking forward to the next chat!"
          }
        ]
      },
      {
        "session_id": "sess-2",
        "messages": [
          {
            "role": "user",
            "content": "Deborah: Hey Jolene, sorry to tell you this but my dad passed away two days ago. It's been really tough on us all - his sudden death left us all kinda shell-shocked. I'm trying to channel my grief by spending more time with family and cherishing the memories. These moments remind me to live life fully."
          },
          {
            "role": "assistant",
            "content": "Jolene: Sorry to hear about your dad, Deborah. Losing a parent is tough - how's it going for you and your family?"
          },
          {
            "role": "user",
            "content": "Deborah: Even though it's hard, it's comforting to look back on the great memories. We looked at the family album. Photos give me peace during difficult times. This is my parents' wedding in 1993."
          },
          {
            "role": "assistant",
            "content": "Jolene: They were a beautiful couple!"
          },
          {
            "role": "user",
            "content": "Deborah: My husband and I are trying to be as good a family as my parents were!"
          },
          {
            "role": "assistant",
            "content": "Jolene: What do you value in your relationship?"
          },
          {
            "role": "user",
            "content": "Deborah: It is love, and openness that have kept us close all these years. Being there for each other has made us both happy. Look what letter I received yesterday!"
          },
          {
            "role": "assistant",
            "content": "Jolene: What touching words! Who is this letter from?"
          },
          {
            "role": "user",
            "content": "Deborah: The group members sent this to me! They thanked me for the positive influence I had on them. Those moments remind me why I'm so passionate about yoga."
          },
          {
            "role": "assistant",
            "content": "Jolene: Where do you most often do yoga?"
          },
          {
            "role": "user",
            "content": "Deborah: This is one of the places where I do it."
          },
          {
            "role": "assistant",
            "content": "Jolene: Where is it?"
          },
          {
            "role": "user",
            "content": "Deborah: That's my old home. I go there now and then for my mom, who passed away. Sitting in that spot by the window gives me peace."
          },
          {
            "role": "assistant",
            "content": "Jolene: Must be great to have that place where you feel connected to her."
          },
          {
            "role": "user",
            "content": "Deborah: Yeah, it's special. I can feel her presence when I sit there and it comforts me."
          },
          {
            "role": "assistant",
            "content": "Jolene: Wow, it sounds like that spot holds a lot of sentimental value. Does it bring back any special memories?"
          },
          {
            "role": "user",
            "content": "Deborah: Yeah, Jolene. She'd sit there every night with a book and a smile, reading was one of her hobbies. It was one of her favorite places in the house."
          },
          {
            "role": "assistant",
            "content": "Jolene: What other hobbies did your mother have?"
          },
          {
            "role": "user",
            "content": "Deborah: Travel was also her great passion!"
          },
          {
            "role": "assistant",
            "content": "Jolene: I want to show you one of my snakes! They always calm me down and make me happy. This is Susie."
          },
          {
            "role": "user",
            "content": "Deborah: Having a pet totally brightens up your life. It's great that it brings you comfort. Do you have any fun moments with your pet that you'd like to share?"
          },
          {
            "role": "assistant",
            "content": "Jolene: I was playing video games and my pet just slinked out of her cage and coiled up next to me - it was too funny! My second snake Seraphim did it. Look at her sly eyes!"
          },
          {
            "role": "user",
            "content": "Deborah: Awww, that's so nice!"
          },
          {
            "role": "assistant",
            "content": "Jolene: I bought it a year ago in Paris."
          },
          {
            "role": "user",
            "content": "Deborah: Cool, Jolene! Pets bring so much happiness!"
          },
          {
            "role": "assistant",
            "content": "Jolene: They are very unusual pets! Here's me and my partner gaming last week - it's so fun. We played the game \"Detroit\" on the console. We are both crazy about this activity!"
          },
          {
            "role": "user",
            "content": "Deborah: Did your boyfriend teach you to play?"
          },
          {
            "role": "assistant",
            "content": "Jolene: Even as a child I learned to play on my own."
          },
          {
            "role": "user",
            "content": "Deborah: Do you only play old games or try new ones?"
          },
          {
            "role": "assistant",
            "content": "Jolene: We are planning to play \"Walking Dead\" next Saturday."
          },
          {
            "role": "user",
            "content": "Deborah: Take care and keep spreading those good vibes!"
          },
          {
            "role": "assistant",
            "content": "Jolene: Thanks, Deb! You too, take care. See ya!"
          }
        ]
      },
      {
        "session_id": "sess-3",
        "messages": [
          {
            "role": "assistant",